Some weights of EsmModel were not initialized from the model checkpoint at facebook/esm1v_t33_650M_UR90S_1 and are newly initialized: ['contact_head.regression.bias', 'contact_head.regression.weight', 'pooler.dense.bias', 'pooler.dense.weight']
You should probably TRAIN this model on a down-stream task to be able to use it for predictions and inference.
============================================================
ELISA THRESHOLD HYPOTHESIS TEST
============================================================

Hypothesis (Hybri): Novo used simple ELISA threshold (1.3-1.5)
Counter (Ours): Novo used P5e-S2 (PSR reclassification + removal)

Loading model...
✅ Model loaded (device: mps)

============================================================
TEST 1: Simple ELISA Threshold (<= 1.3)
============================================================

116 → ELISA <= 1.3 → 86 antibodies
  Specific: 86
  Non-specific: 0

Generating embeddings...
Processing batches:   0%|          | 0/11 [00:00<?, ?it/s]Processing batches:   9%|▉         | 1/11 [00:00<00:05,  1.77it/s]Processing batches:  18%|█▊        | 2/11 [00:00<00:03,  2.40it/s]Processing batches:  27%|██▋       | 3/11 [00:01<00:03,  2.51it/s]Processing batches:  36%|███▋      | 4/11 [00:01<00:02,  2.60it/s]Processing batches:  45%|████▌     | 5/11 [00:01<00:02,  2.79it/s]Processing batches:  55%|█████▍    | 6/11 [00:02<00:01,  3.21it/s]Processing batches:  64%|██████▎   | 7/11 [00:02<00:01,  3.56it/s]Processing batches:  73%|███████▎  | 8/11 [00:02<00:00,  3.44it/s]Processing batches:  82%|████████▏ | 9/11 [00:02<00:00,  3.73it/s]Processing batches:  91%|█████████ | 10/11 [00:03<00:00,  3.81it/s]Processing batches: 100%|██████████| 11/11 [00:03<00:00,  3.35it/s]Processing batches: 100%|██████████| 11/11 [00:03<00:00,  3.12it/s]

Results:
  Confusion Matrix: [[57, 29], [0, 0]]
  Accuracy: 66.28%

Comparison to Novo:
  Novo CM:  [[40, 19], [10, 17]]
  Ours:     [[57, 29], [0, 0]]
  Match: ❌ NO

============================================================
TEST 1: Simple ELISA Threshold (<= 1.5)
============================================================

116 → ELISA <= 1.5 → 93 antibodies
  Specific: 93
  Non-specific: 0

Generating embeddings...
Processing batches:   0%|          | 0/12 [00:00<?, ?it/s]Processing batches:   8%|▊         | 1/12 [00:00<00:02,  4.49it/s]Processing batches:  17%|█▋        | 2/12 [00:00<00:02,  4.52it/s]Processing batches:  25%|██▌       | 3/12 [00:00<00:02,  4.12it/s]Processing batches:  33%|███▎      | 4/12 [00:00<00:01,  4.13it/s]Processing batches:  42%|████▏     | 5/12 [00:01<00:01,  4.14it/s]Processing batches:  50%|█████     | 6/12 [00:01<00:01,  4.27it/s]Processing batches:  58%|█████▊    | 7/12 [00:01<00:01,  4.34it/s]Processing batches:  67%|██████▋   | 8/12 [00:01<00:00,  4.28it/s]Processing batches:  75%|███████▌  | 9/12 [00:02<00:00,  4.38it/s]Processing batches:  83%|████████▎ | 10/12 [00:02<00:00,  4.28it/s]Processing batches:  92%|█████████▏| 11/12 [00:02<00:00,  4.35it/s]Processing batches: 100%|██████████| 12/12 [00:02<00:00,  3.78it/s]Processing batches: 100%|██████████| 12/12 [00:02<00:00,  4.13it/s]

Results:
  Confusion Matrix: [[62, 31], [0, 0]]
  Accuracy: 66.67%

Comparison to Novo:
  Novo CM:  [[40, 19], [10, 17]]
  Ours:     [[62, 31], [0, 0]]
  Match: ❌ NO

============================================================
TEST 2: P5e-S2 Method (PSR Reclassification + Removal)
============================================================

116 → P5e-S2 pipeline → 86 antibodies
  Specific: 59
  Non-specific: 27

Generating embeddings...
Processing batches:   0%|          | 0/11 [00:00<?, ?it/s]Processing batches:   9%|▉         | 1/11 [00:00<00:02,  4.55it/s]Processing batches:  18%|█▊        | 2/11 [00:00<00:01,  4.56it/s]Processing batches:  27%|██▋       | 3/11 [00:00<00:02,  3.66it/s]Processing batches:  36%|███▋      | 4/11 [00:01<00:02,  3.36it/s]Processing batches:  45%|████▌     | 5/11 [00:01<00:01,  3.59it/s]Processing batches:  55%|█████▍    | 6/11 [00:01<00:01,  3.86it/s]Processing batches:  64%|██████▎   | 7/11 [00:01<00:00,  4.03it/s]Processing batches:  73%|███████▎  | 8/11 [00:02<00:00,  4.18it/s]Processing batches:  82%|████████▏ | 9/11 [00:02<00:00,  4.28it/s]Processing batches:  91%|█████████ | 10/11 [00:02<00:00,  3.96it/s]Processing batches: 100%|██████████| 11/11 [00:02<00:00,  3.80it/s]Processing batches: 100%|██████████| 11/11 [00:02<00:00,  3.89it/s]

Results:
  Confusion Matrix: [[40, 19], [10, 17]]
  Accuracy: 66.28%

Comparison to Novo:
  Novo CM:  [[40, 19], [10, 17]]
  Ours:     [[40, 19], [10, 17]]
  Match: ✅ YES

============================================================
SUMMARY
============================================================

| Method | N | Accuracy | CM Match | Confusion Matrix |
|--------|---|----------|----------|------------------|
| ELISA<=1.3   | 86 | 66.28% | ❌        | [[57, 29], [0, 0]] |
| ELISA<=1.5   | 93 | 66.67% | ❌        | [[62, 31], [0, 0]] |
| P5e-S2       | 86 | 66.28% | ✅        | [[40, 19], [10, 17]] |

Novo benchmark: [[40, 19], [10, 17]], 66.28%

============================================================
CONCLUSION
============================================================

✅ P5e-S2 achieves EXACT Novo parity
❌ Simple ELISA thresholds do NOT match

Hybri's hypothesis: REJECTED
Reason: Simple threshold gives wrong label distribution
        (all specific antibodies, no reclassification)

============================================================
